[
	{
		"name": "SANJI",
		"chance": "13.46%",
		"cost": "1000 SHARDS",
		"board": 1,
		"desc": "Auto trains 40% of your Agility multiplier every 4 seconds and buffs Punch damage by 40%",
		"stats": {
			"base": {
				"agility": 0.4
			},
			"modifiers": {
				"punch": {
					"outgoing_damage_increase": 0.4
				}
			}
		}
	},
	{
		"name": "LEVI",
		"chance": "12.39%",
		"cost": "1250 SHARDS",
		"board": 1,
		"desc": "Auto trains 30% of your sword multiplier every 4 seconds",
		"stats": {
			"base": {
				"sword": 0.3
			},
			"modifiers": {}
		}
	},
	{
		"name": "KILLUA",
		"chance": "11.75%",
		"cost": "1250 SHARDS",
		"board": 1,
		"desc": "Auto trains 45% of your Speed multiplier every 4 seconds and nerf Strength damage by 10%",
		"stats": {
			"base": {
				"agility": 0.45
			},
			"modifiers": {
				"strength": {
					"incoming_damage_decrease": 0.1
				}
			}
		}
	},
	{
		"name": "SAKURA",
		"chance": "9.61%",
		"cost": "1500 SHARDS",
		"board": 1,
		"desc": "Auto trains 20% of your Chakra every 4 seconds and heals 3% of your health every 5 seconds",
		"stats": {
			"base": {
				"chakra": 0.2
			},
			"modifiers": {
				"heal": {
					"heal_amount": 0.03
				}
			}
		}
	},
	{
		"name": "PICOLLO",
		"chance": "8.54%",
		"cost": "2000 SHARDS",
		"board": 1,
		"desc": "Auto trains 20% of your Durability and Strength multiplier every 4 seconds.",
		"stats": {
			"base": {
				"durability": 0.2,
				"strength": 0.2
			},
			"modifiers": {}
		}
	},
	{
		"name": "TOJI",
		"chance": "6.41%",
		"cost": "2000 SHARDS",
		"board": 1,
		"desc": "Auto trains 34% of your Strength and Durability multiplier every 4 seconds",
		"stats": {
			"base": {
				"strength": 0.34,
				"durability": 0.34
			},
			"modifiers": {}
		}
	},
	{
		"name": "KANEKI",
		"chance": "5.12%",
		"cost": "2250 SHARDS",
		"board": 1,
		"desc": "Auto trains 30% of your Strength multiplier every 4 seconds. Specially buffs Kagune damage by 15% and nerfs incoming Kagune damage by 20%",
		"stats": {
			"base": {
				"strength": 0.3
			},
			"modifiers": {
				"kagune": {
					"outgoing_damage_increase": 0.15,
					"incoming_damage_decrease": 0.2
				}
			}
		}
	},
	{
		"name": "LUFFY",
		"chance": "4.7%",
		"cost": "3000 SHARDS",
		"board": 1,
		"desc": "Auto trains 40% of your Agility and 35% Strength multiplier every 4 seconds. Specially buffs Fruit damage by 25% and nerfs incoming Fruit damage by 20%",
		"stats": {
			"base": {
				"agility": 0.4,
				"strength": 0.35
			},
			"modifiers": {
				"fruit": {
					"outgoing_damage_increase": 0.25,
					"incoming_damage_decrease": 0.2
				}
			}
		}
	},
	{
		"name": "ASTA",
		"chance": "4.48%",
		"cost": "7500 SHARDS",
		"board": 1,
		"desc": "Auto trains 45% of your sword multiplier every 4 seconds. Specially buffs Grimoire damage by 25% nerfs incoming Grimoire damage by 20%. Also nerfs and buffs Sword Slash damage by 20%",
		"stats": {
			"base": {
				"sword": 0.45
			},
			"modifiers": {
				"grimoire": {
					"outgoing_damage_increase": 0.25,
					"incoming_damage_decrease": 0.2
				},
				"sword_slash": {
					"outgoing_damage_increase": 0.2,
					"incoming_damage_decrease": 0.2
				}
			}
		}
	},
	{
		"name": "JINWOO",
		"chance": "4.06%",
		"cost": "7500 SHARDS",
		"board": 1,
		"desc": "Auto trains 40% of your strength multiplier every 4 seconds. Specially buffs Quirk damage by 25% nerfs incoming Quirk damage by 20%",
		"stats": {
			"base": {
				"strength": 0.4
			},
			"modifiers": {
				"quirk": {
					"outgoing_damage_increase": 0.25,
					"incoming_damage_decrease": 0.2
				}
			}
		}
	},
	{
		"name": "JOTARO",
		"chance": "3.84%",
		"cost": "7500 SHARDS",
		"board": 1,
		"desc": "Auto trains 45% of your Durability multiplier every 4 seconds. Specially buffs stand damage by 20% and nerfs incoming stand damage by 25%",
		"stats": {
			"base": {
				"durability": 0.45
			},
			"modifiers": {
				"stand": {
					"outgoing_damage_increase": 0.2,
					"incoming_damage_decrease": 0.25
				}
			}
		}
	},
	{
		"name": "JIRAIYA",
		"chance": "3.41%",
		"cost": "7500 SHARDS",
		"board": 1,
		"desc": "Auto trains 50% of your Chakra multiplier every 4 seconds. Nerfs chakra damage by 25%",
		"stats": {
			"base": {
				"chakra": 0.5
			},
			"modifiers": {
				"chakra": {
					"incoming_damage_decrease": 0.25
				}
			}
		}
	},
	{
		"name": "NARUTO",
		"chance": "3.2%",
		"cost": "7500 SHARDS",
		"board": 1,
		"desc": "Auto trains 55% of your Chakra multiplier every 4 seconds. Nerfs all Chakra damage by 30% and buffs Chakra damage by 20%",
		"stats": {
			"base": {
				"chakra": 0.55
			},
			"modifiers": {
				"chakra": {
					"outgoing_damage_increase": 0.2,
					"incoming_damage_decrease": 0.3
				}
			}
		}
	},
	{
		"name": "VEGETA",
		"chance": "2.76%",
		"cost": "7500 SHARDS",
		"board": 1,
		"desc": "Auto trains 50% of your Strength multiplier every 4 seconds. Nerfs all Strength damage by 30% and all damage is buffed by 1.6x when health is below 30%",
		"stats": {
			"base": {
				"strength": 0.5
			},
			"modifiers": {
				"strength": {
					"incoming_damage_decrease": 0.3
				},
				"health_threshold": {
					"health_value": 0.3,
					"outgoing_damage_increase": 0.6,
					"incoming_damage_decrease": 0,
					"immunity_duration": 0
				}
			}
		}
	},
	{
		"name": "GENOS",
		"chance": "0.681%",
		"cost": "7500 SHARDS",
		"board": 1,
		"desc": "When the player reaches 20% if his health, all damages are reduced to 30% of their original value. Auto trains 95% of your chakra. Nerfs all player damage by 30% and buffs all damage by 15%",
		"stats": {
			"base": {
				"chakra": 0.95
			},
			"modifiers": {
				"health_threshold": {
					"health_value": 0.2,
					"outgoing_damage_increase": 0,
					"incoming_damage_decrease": 0.7,
					"immunity_duration": 0
				},
				"all_damage": {
					"outgoing_damage_increase": 0.15,
					"incoming_damage_decrease": 0.3
				}
			}
		}
	},
	{
		"name": "BOROS",
		"chance": "0.68%",
		"cost": "7500 SHARDS",
		"board": 1,
		"desc": "Auto trains 30% of your Chakra, 50% strength and Durability multiplier ever 4 seconds. Nerfs all damage by 30% and buffs all damage by 20%",
		"stats": {
			"base": {
				"chakra": 0.3,
				"strength": 0.5,
				"durability": 0.5
			},
			"modifiers": {
				"all_damage": {
					"outgoing_damage_increase": 0.2,
					"incoming_damage_decrease": 0.3
				}
			}
		}
	},
	{
		"name": "ICHIGO",
		"chance": "0.56%",
		"cost": "7500 SHARDS",
		"board": 1,
		"desc": "Auto trains 30% if your strength, 75% of Sword and 50% of Durability multiplier every 4 seconds. Nerfs all player damage by 10% and buffs all damage by 40%",
		"stats": {
			"base": {
				"strength": 0.3,
				"sword": 0.75,
				"durability": 0.5
			},
			"modifiers": {
				"all_damage": {
					"outgoing_damage_increase": 0.4,
					"incoming_damage_decrease": 0.1
				}
			}
		}
	},
	{
		"name": "RENGOKU",
		"chance": "0.42%",
		"cost": "7500 SHARDS",
		"board": 1,
		"desc": "Auto trains 305 of your chakra, 70% of your Sword multiplier every 4 seconds. Nerfs all Chakra damage by 40% and buffs Chakra damage by 30%",
		"stats": {
			"base": {
				"chakra": 0.3,
				"sword": 0.7
			},
			"modifiers": {
				"chakra": {
					"outgoing_damage_increase": 0.3,
					"incoming_damage_decrease": 0.4
				}
			}
		}
	},
	{
		"name": "SASUKE",
		"chance": "0.31%",
		"cost": "7500 SHARDS",
		"board": 1,
		"desc": "Every player kill multiplies damage by 80% for 20 seconds. Trains 80% of Chakra, nerds all damage by 25% and buffs all damage by 50%",
		"stats": {
			"base": {
				"chakra": 0.8
			},
			"modifiers": {
				"kill_effect": {
					"outgoing_damage_multiplier": 0.8,
					"duration": 20
				},
				"all_damage": {
					"outgoing_damage_increase": 0.5,
					"incoming_damage_decrease": 0.25
				}
			}
		}
	},
	{
		"name": "ITACHI",
		"chance": "0.19%",
		"cost": "7500 SHARDS",
		"board": 1,
		"desc": "When the player reaches 105 of his health, he will become immune to all attacks for 8 seconds. Train 80% of Chakra, 20% of Strength and 20% of Durability. He also nerfs all damage by 25% and buffs all damage by 50%",
		"stats": {
			"base": {
				"chakra": 0.8,
				"strength": 0.2,
				"durability": 0.2
			},
			"modifiers": {
				"health_threshold": {
					"health_value": 0.1,
					"outgoing_damage_increase": 0,
					"incoming_damage_decrease": 0,
					"immunity_duration": 8
				},
				"all_damage": {
					"outgoing_damage_increase": 0.5,
					"incoming_damage_decrease": 0.25
				}
			}
		}
	},
	{
		"name": "GOJO",
		"chance": "0.031%",
		"cost": "7500 SHARDS",
		"board": 1,
		"desc": "Auto trains 125% Durability. Nerfs all player damage by 50% buffs all damage by 25% and increases your Chikara Per Min by x1.5",
		"stats": {
			"base": {
				"durability": 1.25
			},
			"modifiers": {
				"all_damage": {
					"outgoing_damage_increase": 0.25,
					"incoming_damage_decrease": 0.5
				},
				"chikara_income": {
					"increased_income_value": 0.5
				}
			}
		}
	},
	{
		"name": "LIGHT YAGAMI",
		"chance": "0.003%",
		"cost": "7500 SHARDS",
		"board": 1,
		"desc": "Auto trains 100% of your Chakra. Nerfs all player damage by 50% buffs all damage by 50% and increases your Chikara Per Min by x1.5",
		"stats": {
			"base": {
				"chakra": 1.0
			},
			"modifiers": {
				"all_damage": {
					"outgoing_damage_increase": 0.5,
					"incoming_damage_decrease": 0.5
				},
				"chikara_income": {
					"increased_income_value": 0.5
				}
			}
		}
	},
	{
		"name": "SAITAMA SERIOUS",
		"chance": "0.005%",
		"cost": "7500 SHARDS",
		"board": 1,
		"desc": "Auto trains 175% of your Strength, 195% of your Durability. Nerfs all player damage by 50% buffs all damage by 100% increase your Chikara Per Min by x1.5, increases your Yen per Min by x1.25.",
		"stats": {
			"base": {
				"strength": 1.75,
				"durability": 1.95
			},
			"modifiers": {
				"all_damage": {
					"outgoing_damage_increase": 1.0,
					"incoming_damage_decrease": 0.5
				},
				"chikara_income": {
					"increased_income_value": 0.5
				},